{"algorithm":"TWAP_SLICED","created_at":"2026-09-04T14:25:00Z","disposition":"VALIDATED_FOR_DISPATCH","max_volume_participation_pct":"15.0","parent_order_id":"ord.9b41","passive_pegging_offset_bps":10,"plan_id":"plan.exec.twap-01","planner_schema_version":1,"schedule_slices":[{"allocated_quantity":"33.00","order_kind":"LIMIT_PASSIVE","planned_release_time":"2026-09-04T14:30:00Z","slice_sequence":1},{"allocated_quantity":"33.00","order_kind":"LIMIT_PASSIVE","planned_release_time":"2026-09-04T14:35:00Z","slice_sequence":2}],"supported_capabilities_verified":true,"target_venue":"venue.nasdaq"}
